<?xml version="1.0" encoding="UTF-8" standalone="no"?>
<!--
  #%L
  CYSEC Platform Core
  %%
  Copyright (C) 2020 - 2026 FHNW (University of Applied Sciences and Arts Northwestern Switzerland)
  %%
  Licensed under the Apache License, Version 2.0 (the "License");
  you may not use this file except in compliance with the License.
  You may obtain a copy of the License at
  
       http://www.apache.org/licenses/LICENSE-2.0
  
  Unless required by applicable law or agreed to in writing, software
  distributed under the License is distributed on an "AS IS" BASIS,
  WITHOUT WARRANTIES OR CONDITIONS OF ANY KIND, either express or implied.
  See the License for the specific language governing permissions and
  limitations under the License.
  #L%
  -->

<answers context="lib-coach.lib-coach-sub.A" readableContext="Coach.SubCoach.A" xmlns="https://smesec.eu" xmlns:xsi="http://www.w3.org/2001/XMLSchema-instance"
         xsi:schemaLocation="https://smesec.eu questionnaire.xsd">
    <questionnaireReference>
        <questionnaireId>lib-coach-sub</questionnaireId>
        <filename>/var/lib/cysec/coaches/lib-coach-sub.xml</filename>
    </questionnaireReference>
    <answer qid="q1">
        <text>q1o3</text>
    </answer>
    <answer qid="q2">
        <text>q2o4</text>
    </answer>
</answers>
